{
  "schema_version": "1.0.0",
  "command": "report",
  "producer_version": "0.5.0",
  "split": {
    "schema_version": "0.5.0",
    "command": "split",
    "execution_mode": "restartable",
    "maximum_pst_bytes": 4294967296,
    "resumed": true,
    "keep_work": true,
    "disk_preflight": { "required_bytes": 4096, "available_bytes": 8589934592, "existing_job_bytes": 4096 },
    "metrics": {
      "elapsed_millis": 1000,
      "source_bytes": 4096,
      "output_bytes": 8192,
      "average_source_bytes_per_second": 4096,
      "peak_process_rss_bytes": 67108864,
      "payload_pack_bytes_written": 3584,
      "peak_payload_pack_bytes": 3584,
      "active_pst_bytes_written": 8192,
      "finalized_output_bytes": 8192,
      "validator_input_bytes": 16384,
      "peak_payload_and_active_pst_bytes": 11776,
      "supervisor_filesystem_read_bytes": null,
      "supervisor_filesystem_write_bytes": null
    },
    "recovery": {
      "schema_version": "0.5.0",
      "command": "recover",
      "mode": "balanced",
      "source": {
        "canonical_path": "/external/example.pst",
        "device": 1,
        "inode": 2,
        "size_bytes": 4096,
        "modified_at": "2026-07-20T00:00:00Z",
        "sha256": "aaaaaaaaaaaaaaaaaaaaaaaaaaaaaaaaaaaaaaaaaaaaaaaaaaaaaaaaaaaaaaaa"
      },
      "job_directory": "/output/example-job",
      "normal_items": 8,
      "recovered_items": 1,
      "orphan_items": 0,
      "fragment_items": 0,
      "committed_candidates": 9,
      "complete_candidates": 9,
      "partial_candidates": 0,
      "unsupported_candidates": 0,
      "blob_count": 4,
      "blob_bytes": 3584,
      "issues": 0,
      "issues_dropped": 0,
      "worker_attempts": 1,
      "worker_failures": 0,
      "isolated_units": 0,
      "peak_worker_rss_bytes": 67108864,
      "interrupted": false,
      "source_unchanged": true
    },
    "rejection_counts": {},
    "parts": [{
      "index": 1,
      "filename": "part-0001.pst",
      "byte_len": 8192,
      "sha256": "bbbbbbbbbbbbbbbbbbbbbbbbbbbbbbbbbbbbbbbbbbbbbbbbbbbbbbbbbbbbbbbb",
      "folder_count": 6,
      "message_count": 9,
      "oversize": false,
      "partial": false,
      "omitted_folders": 0,
      "omitted_properties": 0,
      "omitted_attachments": 0
    }],
    "written_candidates": 9,
    "partial": false,
    "terminal_failure": null
  }
}
